<?xml version="1.0" encoding="UTF8"?>
<!ELEMENT plugin-config  (global? | dataset_model*)>
<!ATTLIST plugin-config 
    name CDATA #REQUIRED
>

<!-- 
==========================
global
========================== 
-->
<!ELEMENT global (java? | cpp?)>
<!ELEMENT java (set*)>
<!ELEMENT cpp (set*)>
<!ELEMENT set EMPTY>
<!ATTLIST set 
    name CDATA #REQUIRED
    value CDATA #REQUIRED
>

<!--
==========================
dataset_model
========================== 
-->
<!ELEMENT dataset-model (criteria? , parameters? , plugin? )>
<!ATTLIST dataset-model 
    name CDATA #REQUIRED
>
    
<!--
==========================
plugin
========================== 
--> 
<!ELEMENT plugin ( java? | cpp? )>


<!--
==========================
criteria
========================== 
-->
<!ELEMENT criteria (if*)>
<!ELEMENT if EMPTY>
<!ATTLIST if 
    target CDATA #REQUIRED
    exist ( true | false ) #IMPLIED
    equal CDATA #IMPLIED
    not_equal CDATA #IMPLIED
>


<!--
==========================
parameters
========================== 
-->
<!ELEMENT parameters (parameter*)>
<!ELEMENT parameter (value?)>
<!ATTLIST parameter
    name CDATA #REQUIRED
    value CDATA #IMPLIED
>

<!ELEMENT value EMPTY>
<!ATTLIST value 
    type ( exist | name | value | constant | equal ) #REQUIRED
    target CDATA #IMPLIED
    test ( true | false ) #IMPLIED
    constant CDATA #IMPLIED
>


