<?xml version="1.0" encoding="UTF8"?>
<!DOCTYPE plugin-config SYSTEM "../plugin_config_file.dtd">
<plugin-config name="SOLEIL's NeXus plug-in configuration file">
<!-- ============================================
==  CONFIG 1: detection by file information    ==
============================================= -->
  <dataset-model name="fully_defined_conf">
    <criteria>
      <if exist="true" target="/{NXentry}/{NXinstrument}"/>
      <if exist="true" target="/{NXentry}/acquisition_model"/>
    </criteria>

    <parameters> 
      <parameter name="BEAMLINE" type="name" target="/{NXentry}/{NXinstrument}"/>
      <parameter name="MODEL" type="value" target="/{NXentry}/acquisition_model"/>
    </parameters>

    <plugin>
      <java>
        <set name="log_debug" value="true"/>
        <set name="N4T_buffer_size" value="300"/>
      </java>
    </plugin>
  </dataset-model>

<!-- ============================================
==  CONFIG 2: all beamlines quickexafs         ==
============================================= -->
  <dataset-model name="generic_quickexafs">
    <criteria>
      <if exist="true" target="/QuickEXAFS*{NXentry}/{NXinstrument}"/>
      <if exist="false" target="/{NXentry}/acquisition_model"/>
    </criteria>
    
    <parameters>
      <parameter name="BEAMLINE" type="name" target="/{NXentry}/{NXinstrument}"/>
      <parameter name="MODEL" type="constant" constant="quickexafs"/>
    </parameters>

    <plugin>
      <java>
        <set name="log_debug" value="true"/>
        <set name="N4T_buffer_size" value="300"/>
      </java>
    </plugin>
  </dataset-model>

<!-- ============================================
==  CONFIG 3: all beamlines scanserver         ==
============================================= -->
  <dataset-model name="generic_scanserver">
    <criteria>
      <if exist="true" target="/{NXentry}/{NXinstrument}"/>
      <if exist="false" target="/QuickEXAFS*{NXentry}/{NXinstrument}"/>
      <if exist="false" target="/{NXentry}/acquisition_model"/>
      <if exist="true" target="/{NXentry}/scan_data{NXdata}/time_1"/>
    </criteria>
    
    <parameters>
      <parameter name="BEAMLINE" type="name" target="/{NXentry}/{NXinstrument}"/>
      <parameter name="MODEL" type="constant" constant="scanserver"/>
    </parameters>

    <plugin>
      <java>
        <set name="log_debug" value="true"/>
        <set name="N4T_buffer_size" value="300"/>
      </java>
    </plugin>
  </dataset-model>

<!-- ============================================
==  CONFIG 5: all beamlines passerelle         ==
============================================= -->
  <dataset-model name="ANTARES_passerelle">
    <criteria>
      <if exist="true" target="/{NXentry}/ANTARES"/>
      <if exist="false" target="/{NXentry}/acquisition_model"/>
      <if exist="false" target="/{NXentry}/scan_data{NXdata}/time_1"/>
    </criteria>
<!-- 
    <parameters>
      <parameter name="BEAMLINE" type="constant" constant="antares"/>
      <parameter name="MODEL" type="constant" constant="passerelle" />
      </parameter>
    </parameters>
-->
    <plugin>
      <java>
        <set name="BEAMLINE" value="antares"/>
        <set name="MODEL" value="passerelle"/>
        <set name="fast_iterator" value="true"/>
        <set name="log_debug" value="true"/>
        <set name="N4T_buffer_size" value="300"/>
      </java>
    </plugin>
  </dataset-model>

<!-- ============================================
==  CONFIG 4: all beamlines flyscan            ==
============================================= -->
  <dataset-model name="generic_flyscan">
    <criteria>
      <if exist="true" target="/{NXentry}/{NXinstrument}"/>
      <if exist="false" target="/QuickEXAFS*{NXentry}/{NXinstrument}"/>
      <if exist="false" target="/{NXentry}/acquisition_model"/>
      <if exist="false" target="/{NXentry}/scan_data{NXdata}/time_1"/>
    </criteria>
    
    <parameters>
      <parameter name="BEAMLINE" type="name" target="/{NXentry}/{NXinstrument}"/>
      <parameter name="MODEL" type="constant" constant="flyscan"/>
    </parameters>
    
    <plugin>
      <java>
        <set name="log_debug" value="true"/>
        <set name="N4T_buffer_size" value="300"/>
      </java>
    </plugin>
  </dataset-model>

<!-- ============================================
==  CONFIG 5: all beamlines passerelle         ==
============================================= -->
  <dataset-model name="generic_passerelle">
    <criteria>
      <if exist="true" target="/{NXentry}/{NXinstrument}"/>
      <if exist="false" target="/{NXentry}/ANTARES"/>
      <if exist="false" target="/QuickEXAFS*{NXentry}/{NXinstrument}"/>
      <if exist="false" target="/{NXentry}/acquisition_model"/>
      <if exist="false" target="/{NXentry}/scan_data{NXdata}/time_1"/>
    </criteria>
    
    <parameters>
      <parameter name="BEAMLINE" type="name" target="/{NXentry}/{NXinstrument}"/>
      <parameter name="MODEL" type="constant" constant="passerelle"/>
    </parameters>

    <plugin>
      <java>
        <set name="log_debug" value="true"/>
        <set name="N4T_buffer_size" value="300"/>
      </java>
    </plugin>
  </dataset-model>

<!-- ============================================
==  CONFIG 5: test files                       ==
============================================= -->
  <dataset-model name="contacq_flyscan">
    <criteria>
      <if exist="true" target="/{NXentry}/contacq{NXinstrument}"/>
      <if exist="false" target="/QuickEXAFS*{NXentry}/{NXinstrument}"/>
      <if exist="false" target="/{NXentry}/acquisition_model"/>
      <if exist="false" target="/{NXentry}/scan_data{NXdata}/time_1"/>
    </criteria>
    
    <parameters>
      <parameter name="BEAMLINE" type="constant" constant="contacq"/>
      <parameter name="MODEL" type="constant" constant="flyscan" />
    </parameters>
    
    <plugin>
      <java>
        <set name="log_debug" value="true"/>
        <set name="N4T_buffer_size" value="300"/>
      </java>
    </plugin>
  </dataset-model>

<!-- ============================================
==  CONFIG 6: test files                       ==
============================================= -->
  <dataset-model name="contacq_passerelle">
    <criteria>
      <if exist="false" target="/{NXentry}/{NXinstrument}"/>
      <if exist="false" target="/QuickEXAFS*{NXentry}/{NXinstrument}"/>
      <if exist="false" target="/{NXentry}/acquisition_model"/>
      <if exist="true" target="/{NXentry}/scan_data{NXdata}/time_1"/>
    </criteria>
    
    <parameters>
      <parameter name="BEAMLINE" type="constant" constant="contacq"/>
      <parameter name="MODEL" type="constant" constant="passerelle"/>
    </parameters>
    
    <plugin>
      <java>
        <set name="log_debug" value="true" />
        <set name="N4T_buffer_size" value="300" />
        <set name="OPTIMAL_DATA_SIZE" value="3000000" />
      </java>
    </plugin>
  </dataset-model>

<!-- ============================================
==  CONFIG 5: test files                       ==
============================================= -->
  <dataset-model name="test_flyscan">
    <criteria>
      <if exist="false" target="/{NXentry}/{NXinstrument}"/>
      <if exist="true" target="/{NXentry}/scan_data{NXdata}/"/>
    </criteria>
    
    <parameters>
      <parameter name="BEAMLINE" type="constant" constant="contacq"/>
      <parameter name="MODEL" type="constant" constant="flyscan" />
    </parameters>
    
    <plugin>
      <java>
        <set name="log_debug" value="true"/>
        <set name="N4T_buffer_size" value="300"/>
      </java>
    </plugin>
  </dataset-model>

<!-- ============================================
==  Global section                             ==
============================================= -->
  <global>
    <java>
     <set name="CDMA_DEBUG" value="true"/>
    </java>
  </global>
</plugin-config>

